tcpdump: verbose output suppressed, use -v[v]... for full protocol decode
listening on lo0, link-type NULL (BSD loopback), snapshot length 524288 bytes
15:58:52.955171 IP localhost.54228 > localhost.hbci: Flags [P.], seq 274412925:274413124, ack 745212623, win 6067, options [nop,nop,TS val 3861590077 ecr 3585609894], length 199
E.....@.@................[5},k
............
.+0=....POST /query HTTP/1.1
User-Agent: Dexador/0.9.15 (SBCL 2.3.10); Darwin; 23.1.0
Host: localhost:3000
Accept: application/transit+json
Content-Type: application/transit+json
Content-Length: 633


15:58:52.955205 IP localhost.hbci > localhost.54228: Flags [.], ack 199, win 6363, options [nop,nop,TS val 3585716534 ecr 3861590077], length 0
E..4..@.@...............,k
..[6D.....(.....
...6.+0=
15:58:52.955221 IP localhost.54228 > localhost.hbci: Flags [P.], seq 199:832, ack 1, win 6067, options [nop,nop,TS val 3861590077 ecr 3585716534], length 633
E.....@.@................[6D,k
............
.+0=...6["^ ","~:query",["~#xtdb/list"," ( -> ( unify ( from :part [ { :xt/id p } p-name ] ) ( where ( like p-name \"%green%\" ) ) ( from :orders [ { :xt/id o } o-orderdate ] ) ( from :lineitem [ { :l-orderkey o :l-suppkey s :l-partkey p } l-quantity l-extendedprice l-discount ] ) ( from :partsupp [ { :ps-partkey p :ps-suppkey s } ps-supplycost ] ) ( from :supplier [ { :xt/id s :s-nationkey n } ] ) ( from :nation [ { :xt/id n :n-name nation } ] ) ) ( with { :o-year ( extract \"YEAR\" o-orderdate ) } ) ( aggregate nation o-year { :sum-profit ( sum ( - ( * l-extendedprice ( - 1 l-discount ) ) ( * ps-supplycost l-quantity ) ) ) } ) )"]]
15:58:52.955225 IP localhost.hbci > localhost.54228: Flags [.], ack 832, win 6353, options [nop,nop,TS val 3585716534 ecr 3861590077], length 0
E..4..@.@...............,k
..[8......(.....
...6.+0=
15:58:53.616427 IP localhost.hbci > localhost.54228: Flags [P.], seq 1:147, ack 832, win 6353, options [nop,nop,TS val 3585717195 ecr 3861590077], length 146
E.....@.@...............,k
..[8............
.....+0=HTTP/1.1 200 OK
Content-Type: application/transit+json; charset=utf-8
Transfer-Encoding: chunked
Server: Jetty(11.0.18)

10
["^ ","~:nation"
15:58:53.616442 IP localhost.hbci > localhost.54228: Flags [P.], seq 147:169, ack 832, win 6353, options [nop,nop,TS val 3585717195 ecr 3861590077], length 22
E..J..@.@...............,k.a.[8......>.....
.....+0=
10
,"UNITED STATES"
15:58:53.616446 IP localhost.hbci > localhost.54228: Flags [P.], seq 169:185, ack 832, win 6353, options [nop,nop,TS val 3585717195 ecr 3861590077], length 16
E..D..@.@...............,k.w.[8......8.....
.....+0=
B
,"~:o-year"
15:58:53.616454 IP localhost.hbci > localhost.54228: Flags [P.], seq 185:195, ack 832, win 6353, options [nop,nop,TS val 3585717195 ecr 3861590077], length 10
E..>..@.@...............,k...[8......2.....
.....+0=
5
,1995
15:58:53.616458 IP localhost.hbci > localhost.54228: Flags [P.], seq 195:215, ack 832, win 6353, options [nop,nop,TS val 3585717195 ecr 3861590077], length 20
E..H..@.@...............,k...[8......<.....
.....+0=
F
,"~:sum-profit"
15:58:53.616467 IP localhost.hbci > localhost.54228: Flags [P.], seq 215:239, ack 832, win 6353, options [nop,nop,TS val 3585717195 ecr 3861590077], length 24
E..L..@.@...............,k...[8......@.....
.....+0=
12
,2489531.243900001
15:58:53.616469 IP localhost.hbci > localhost.54228: Flags [P.], seq 239:245, ack 832, win 6353, options [nop,nop,TS val 3585717195 ecr 3861590077], length 6
E..:..@.@...............,k...[8............
.....+0=
1
]
15:58:53.616475 IP localhost.hbci > localhost.54228: Flags [P.], seq 245:268, ack 832, win 6353, options [nop,nop,TS val 3585717195 ecr 3861590077], length 23
E..K..@.@...............,k...[8......?.....
.....+0=
11
 ["^ ","~:nation"
15:58:53.616477 IP localhost.hbci > localhost.54228: Flags [P.], seq 268:283, ack 832, win 6353, options [nop,nop,TS val 3585717195 ecr 3861590077], length 15
E..C..@.@...............,k...[8......7.....
.....+0=
A
,"GERMANY"
15:58:53.616478 IP localhost.hbci > localhost.54228: Flags [P.], seq 283:299, ack 832, win 6353, options [nop,nop,TS val 3585717195 ecr 3861590077], length 16
E..D..@.@...............,k...[8......8.....
.....+0=
B
,"~:o-year"
15:58:53.616482 IP localhost.hbci > localhost.54228: Flags [P.], seq 299:309, ack 832, win 6353, options [nop,nop,TS val 3585717195 ecr 3861590077], length 10
E..>..@.@...............,k...[8......2.....
.....+0=
5
,1992
15:58:53.616485 IP localhost.hbci > localhost.54228: Flags [P.], seq 309:329, ack 832, win 6353, options [nop,nop,TS val 3585717195 ecr 3861590077], length 20
E..H..@.@...............,k...[8......<.....
.....+0=
F
,"~:sum-profit"
15:58:53.616488 IP localhost.hbci > localhost.54228: Flags [P.], seq 329:353, ack 832, win 6353, options [nop,nop,TS val 3585717195 ecr 3861590077], length 24
E..L..@.@...............,k...[8......@.....
.....+0=
12
,2878462.723600002
15:58:53.616492 IP localhost.54228 > localhost.hbci: Flags [.], ack 147, win 6065, options [nop,nop,TS val 3861590738 ecr 3585717195], length 0
E..4..@.@................[8.,k.a.....(.....
.+2.....
15:58:53.616493 IP localhost.hbci > localhost.54228: Flags [P.], seq 353:359, ack 832, win 6353, options [nop,nop,TS val 3585717195 ecr 3861590077], length 6
E..:..@.@...............,k./.[8............
.....+0=
1
]
15:58:53.616500 IP localhost.hbci > localhost.54228: Flags [P.], seq 359:382, ack 832, win 6353, options [nop,nop,TS val 3585717195 ecr 3861590077], length 23
E..K..@.@...............,k.5.[8......?.....
.....+0=
11
 ["^ ","~:nation"
15:58:53.616502 IP localhost.hbci > localhost.54228: Flags [P.], seq 382:397, ack 832, win 6353, options [nop,nop,TS val 3585717195 ecr 3861590077], length 15
E..C..@.@...............,k.L.[8......7.....
.....+0=
A
,"MOROCCO"
15:58:53.616505 IP localhost.hbci > localhost.54228: Flags [P.], seq 397:413, ack 832, win 6353, options [nop,nop,TS val 3585717195 ecr 3861590077], length 16
E..D..@.@...............,k.[.[8......8.....
.....+0=
B
,"~:o-year"
15:58:53.616506 IP localhost.hbci > localhost.54228: Flags [P.], seq 413:423, ack 832, win 6353, options [nop,nop,TS val 3585717195 ecr 3861590077], length 10
E..>..@.@...............,k.k.[8......2.....
.....+0=
5
,1998
15:58:53.616509 IP localhost.hbci > localhost.54228: Flags [P.], seq 423:443, ack 832, win 6353, options [nop,nop,TS val 3585717195 ecr 3861590077], length 20
E..H..@.@...............,k.u.[8......<.....
.....+0=
F
,"~:sum-profit"
15:58:53.616513 IP localhost.hbci > localhost.54228: Flags [P.], seq 443:468, ack 832, win 6353, options [nop,nop,TS val 3585717195 ecr 3861590077], length 25
E..M..@.@...............,k...[8......A.....
.....+0=
13
,1352458.2558999995
15:58:53.616517 IP localhost.54228 > localhost.hbci: Flags [.], ack 169, win 6065, options [nop,nop,TS val 3861590738 ecr 3585717195], length 0
E..4..@.@................[8.,k.w.....(.....
.+2.....
15:58:53.616518 IP localhost.hbci > localhost.54228: Flags [P.], seq 468:474, ack 832, win 6353, options [nop,nop,TS val 3585717195 ecr 3861590077], length 6
E..:..@.@...............,k...[8............
.....+0=
1
]
15:58:53.616525 IP localhost.hbci > localhost.54228: Flags [P.], seq 474:497, ack 832, win 6353, options [nop,nop,TS val 3585717195 ecr 3861590077], length 23
E..K..@.@...............,k...[8......?.....
.....+0=
11
 ["^ ","~:nation"
15:58:53.616529 IP localhost.hbci > localhost.54228: Flags [P.], seq 497:517, ack 832, win 6353, options [nop,nop,TS val 3585717195 ecr 3861590077], length 20
E..H..@.@...............,k...[8......<.....
.....+0=
F
,"SAUDI ARABIA"
15:58:53.616532 IP localhost.hbci > localhost.54228: Flags [P.], seq 517:533, ack 832, win 6353, options [nop,nop,TS val 3585717195 ecr 3861590077], length 16
E..D..@.@...............,k...[8......8.....
.....+0=
B
,"~:o-year"
15:58:53.616534 IP localhost.hbci > localhost.54228: Flags [P.], seq 533:543, ack 832, win 6353, options [nop,nop,TS val 3585717195 ecr 3861590077], length 10
E..>..@.@...............,k...[8......2.....
.....+0=
5
,1996
15:58:53.616538 IP localhost.hbci > localhost.54228: Flags [P.], seq 543:563, ack 832, win 6353, options [nop,nop,TS val 3585717195 ecr 3861590077], length 20
E..H..@.@...............,k...[8......<.....
.....+0=
F
,"~:sum-profit"
15:58:53.616543 IP localhost.hbci > localhost.54228: Flags [P.], seq 563:588, ack 832, win 6353, options [nop,nop,TS val 3585717195 ecr 3861590077], length 25
E..M..@.@...............,k...[8......A.....
.....+0=
13
,2204398.2677999996
15:58:53.616547 IP localhost.hbci > localhost.54228: Flags [P.], seq 588:594, ack 832, win 6353, options [nop,nop,TS val 3585717195 ecr 3861590077], length 6
E..:..@.@...............,k...[8............
.....+0=
1
]
15:58:53.616551 IP localhost.54228 > localhost.hbci: Flags [.], ack 185, win 6065, options [nop,nop,TS val 3861590738 ecr 3585717195], length 0
E..4..@.@................[8.,k.......(.....
.+2.....
15:58:53.616553 IP localhost.hbci > localhost.54228: Flags [P.], seq 594:617, ack 832, win 6353, options [nop,nop,TS val 3585717195 ecr 3861590077], length 23
E..K..@.@...............,k. .[8......?.....
.....+0=
11
 ["^ ","~:nation"
15:58:53.616557 IP localhost.hbci > localhost.54228: Flags [P.], seq 617:630, ack 832, win 6353, options [nop,nop,TS val 3585717195 ecr 3861590077], length 13
E..A..@.@...............,k.7.[8......5.....
.....+0=
8
,"KENYA"
15:58:53.616561 IP localhost.hbci > localhost.54228: Flags [P.], seq 630:646, ack 832, win 6353, options [nop,nop,TS val 3585717195 ecr 3861590077], length 16
E..D..@.@...............,k.D.[8......8.....
.....+0=
B
,"~:o-year"
15:58:53.616563 IP localhost.54228 > localhost.hbci: Flags [.], ack 195, win 6064, options [nop,nop,TS val 3861590738 ecr 3585717195], length 0
E..4..@.@................[8.,k.......(.....
.+2.....
15:58:53.616564 IP localhost.hbci > localhost.54228: Flags [P.], seq 646:656, ack 832, win 6353, options [nop,nop,TS val 3585717195 ecr 3861590077], length 10
E..>..@.@...............,k.T.[8......2.....
.....+0=
5
,1996
15:58:53.616568 IP localhost.hbci > localhost.54228: Flags [P.], seq 656:676, ack 832, win 6353, options [nop,nop,TS val 3585717195 ecr 3861590077], length 20
E..H..@.@...............,k.^.[8......<.....
.....+0=
F
,"~:sum-profit"
15:58:53.616573 IP localhost.hbci > localhost.54228: Flags [P.], seq 676:701, ack 832, win 6353, options [nop,nop,TS val 3585717195 ecr 3861590077], length 25
E..M..@.@...............,k.r.[8......A.....
.....+0=
13
,2022732.3616999993
15:58:53.616575 IP localhost.54228 > localhost.hbci: Flags [.], ack 215, win 6064, options [nop,nop,TS val 3861590738 ecr 3585717195], length 0
E..4..@.@................[8.,k.......(.....
.+2.....
15:58:53.616576 IP localhost.hbci > localhost.54228: Flags [P.], seq 701:707, ack 832, win 6353, options [nop,nop,TS val 3585717195 ecr 3861590077], length 6
E..:..@.@...............,k...[8............
.....+0=
1
]
15:58:53.616583 IP localhost.hbci > localhost.54228: Flags [P.], seq 707:730, ack 832, win 6353, options [nop,nop,TS val 3585717195 ecr 3861590077], length 23
E..K..@.@...............,k...[8......?.....
.....+0=
11
 ["^ ","~:nation"
15:58:53.616587 IP localhost.hbci > localhost.54228: Flags [P.], seq 730:743, ack 832, win 6353, options [nop,nop,TS val 3585717195 ecr 3861590077], length 13
E..A..@.@...............,k...[8......5.....
.....+0=
8
,"INDIA"
15:58:53.616588 IP localhost.54228 > localhost.hbci: Flags [.], ack 239, win 6064, options [nop,nop,TS val 3861590738 ecr 3585717195], length 0
E..4..@.@................[8.,k.......(.....
.+2.....
15:58:53.616589 IP localhost.hbci > localhost.54228: Flags [P.], seq 743:759, ack 832, win 6353, options [nop,nop,TS val 3585717195 ecr 3861590077], length 16
E..D..@.@...............,k...[8......8.....
.....+0=
B
,"~:o-year"
15:58:53.616594 IP localhost.hbci > localhost.54228: Flags [P.], seq 759:769, ack 832, win 6353, options [nop,nop,TS val 3585717195 ecr 3861590077], length 10
E..>..@.@...............,k...[8......2.....
.....+0=
5
,1996
15:58:53.616598 IP localhost.hbci > localhost.54228: Flags [P.], seq 769:789, ack 832, win 6353, options [nop,nop,TS val 3585717195 ecr 3861590077], length 20
E..H..@.@...............,k...[8......<.....
.....+0=
F
,"~:sum-profit"
15:58:53.616599 IP localhost.54228 > localhost.hbci: Flags [.], ack 245, win 6064, options [nop,nop,TS val 3861590738 ecr 3585717195], length 0
E..4..@.@................[8.,k.......(.....
.+2.....
15:58:53.616602 IP localhost.hbci > localhost.54228: Flags [P.], seq 789:807, ack 832, win 6353, options [nop,nop,TS val 3585717195 ecr 3861590077], length 18
E..F..@.@...............,k...[8......:.....
.....+0=
D
,2671136.5005
15:58:53.616605 IP localhost.hbci > localhost.54228: Flags [P.], seq 807:813, ack 832, win 6353, options [nop,nop,TS val 3585717195 ecr 3861590077], length 6
E..:..@.@...............,k...[8............
.....+0=
1
]
15:58:53.616610 IP localhost.54228 > localhost.hbci: Flags [.], ack 268, win 6063, options [nop,nop,TS val 3861590738 ecr 3585717195], length 0
E..4..@.@................[8.,k.......(.....
.+2.....
15:58:53.616611 IP localhost.hbci > localhost.54228: Flags [P.], seq 813:836, ack 832, win 6353, options [nop,nop,TS val 3585717195 ecr 3861590077], length 23
E..K..@.@...............,k...[8......?.....
.....+0=
11
 ["^ ","~:nation"
15:58:53.616617 IP localhost.hbci > localhost.54228: Flags [P.], seq 836:850, ack 832, win 6353, options [nop,nop,TS val 3585717195 ecr 3861590077], length 14
E..B..@.@...............,k...[8......6.....
.....+0=
9
,"BRAZIL"
15:58:53.616621 IP localhost.54228 > localhost.hbci: Flags [.], ack 283, win 6063, options [nop,nop,TS val 3861590738 ecr 3585717195], length 0
E..4..@.@................[8.,k.......(.....
.+2.....
15:58:53.616622 IP localhost.hbci > localhost.54228: Flags [P.], seq 850:866, ack 832, win 6353, options [nop,nop,TS val 3585717195 ecr 3861590077], length 16
E..D..@.@...............,k. .[8......8.....
.....+0=
B
,"~:o-year"
15:58:53.616628 IP localhost.hbci > localhost.54228: Flags [P.], seq 866:876, ack 832, win 6353, options [nop,nop,TS val 3585717195 ecr 3861590077], length 10
E..>..@.@...............,k.0.[8......2.....
.....+0=
5
,1997
15:58:53.616631 IP localhost.hbci > localhost.54228: Flags [P.], seq 876:896, ack 832, win 6353, options [nop,nop,TS val 3585717195 ecr 3861590077], length 20
E..H..@.@...............,k.:.[8......<.....
.....+0=
F
,"~:sum-profit"
15:58:53.616635 IP localhost.hbci > localhost.54228: Flags [P.], seq 896:914, ack 832, win 6353, options [nop,nop,TS val 3585717195 ecr 3861590077], length 18
E..F..@.@...............,k.N.[8......:.....
.....+0=
D
,1966920.3662
15:58:53.616638 IP localhost.hbci > localhost.54228: Flags [P.], seq 914:920, ack 832, win 6353, options [nop,nop,TS val 3585717195 ecr 3861590077], length 6
E..:..@.@...............,k.`.[8............
.....+0=
1
]
15:58:53.616643 IP localhost.54228 > localhost.hbci: Flags [.], ack 299, win 6063, options [nop,nop,TS val 3861590738 ecr 3585717195], length 0
E..4..@.@................[8.,k.......(.....
.+2.....
15:58:53.616644 IP localhost.hbci > localhost.54228: Flags [P.], seq 920:943, ack 832, win 6353, options [nop,nop,TS val 3585717195 ecr 3861590077], length 23
E..K..@.@...............,k.f.[8......?.....
.....+0=
11
 ["^ ","~:nation"
15:58:53.616649 IP localhost.hbci > localhost.54228: Flags [P.], seq 943:957, ack 832, win 6353, options [nop,nop,TS val 3585717195 ecr 3861590077], length 14
E..B..@.@...............,k.}.[8......6.....
.....+0=
9
,"JORDAN"
15:58:53.616654 IP localhost.hbci > localhost.54228: Flags [P.], seq 957:973, ack 832, win 6353, options [nop,nop,TS val 3585717195 ecr 3861590077], length 16
E..D..@.@...............,k...[8......8.....
.....+0=
B
,"~:o-year"
15:58:53.616656 IP localhost.54228 > localhost.hbci: Flags [.], ack 309, win 6063, options [nop,nop,TS val 3861590738 ecr 3585717195], length 0
E..4..@.@................[8.,k.......(.....
.+2.....
15:58:53.616657 IP localhost.hbci > localhost.54228: Flags [P.], seq 973:983, ack 832, win 6353, options [nop,nop,TS val 3585717195 ecr 3861590077], length 10
E..>..@.@...............,k...[8......2.....
.....+0=
5
,1997
15:58:53.616662 IP localhost.hbci > localhost.54228: Flags [P.], seq 983:1003, ack 832, win 6353, options [nop,nop,TS val 3585717195 ecr 3861590077], length 20
E..H..@.@...............,k...[8......<.....
.....+0=
F
,"~:sum-profit"
15:58:53.616666 IP localhost.hbci > localhost.54228: Flags [P.], seq 1003:1028, ack 832, win 6353, options [nop,nop,TS val 3585717195 ecr 3861590077], length 25
E..M..@.@...............,k...[8......A.....
.....+0=
13
,1812794.7414000004
15:58:53.616669 IP localhost.54228 > localhost.hbci: Flags [.], ack 329, win 6062, options [nop,nop,TS val 3861590738 ecr 3585717195], length 0
E..4..@.@................[8.,k.......(.....
.+2.....
15:58:53.616671 IP localhost.hbci > localhost.54228: Flags [P.], seq 1028:1034, ack 832, win 6353, options [nop,nop,TS val 3585717195 ecr 3861590077], length 6
E..:..@.@...............,k...[8............
.....+0=
1
]
15:58:53.616675 IP localhost.hbci > localhost.54228: Flags [P.], seq 1034:1057, ack 832, win 6353, options [nop,nop,TS val 3585717195 ecr 3861590077], length 23
E..K..@.@...............,k...[8......?.....
.....+0=
11
 ["^ ","~:nation"
15:58:53.616679 IP localhost.hbci > localhost.54228: Flags [P.], seq 1057:1074, ack 832, win 6353, options [nop,nop,TS val 3585717195 ecr 3861590077], length 17
E..E..@.@...............,k...[8......9.....
.....+0=
C
,"INDONESIA"
15:58:53.616683 IP localhost.54228 > localhost.hbci: Flags [.], ack 353, win 6062, options [nop,nop,TS val 3861590738 ecr 3585717195], length 0
E..4..@.@................[8.,k./.....(.....
.+2.....
15:58:53.616684 IP localhost.hbci > localhost.54228: Flags [P.], seq 1074:1090, ack 832, win 6353, options [nop,nop,TS val 3585717195 ecr 3861590077], length 16
E..D..@.@...............,k...[8......8.....
.....+0=
B
,"~:o-year"
15:58:53.616689 IP localhost.hbci > localhost.54228: Flags [P.], seq 1090:1100, ack 832, win 6353, options [nop,nop,TS val 3585717195 ecr 3861590077], length 10
E..>..@.@...............,k...[8......2.....
.....+0=
5
,1992
15:58:53.616702 IP localhost.hbci > localhost.54228: Flags [P.], seq 1100:1120, ack 832, win 6353, options [nop,nop,TS val 3585717195 ecr 3861590738], length 20
E..H..@.@...............,k...[8......<.....
.....+2.
F
,"~:sum-profit"
15:58:53.616707 IP localhost.hbci > localhost.54228: Flags [P.], seq 1120:1137, ack 832, win 6353, options [nop,nop,TS val 3585717195 ecr 3861590738], length 17
E..E..@.@...............,k...[8......9.....
.....+2.
C
,2025870.443
15:58:53.616708 IP localhost.54228 > localhost.hbci: Flags [.], ack 359, win 6062, options [nop,nop,TS val 3861590738 ecr 3585717195], length 0
E..4..@.@................[8.,k.5.....(.....
.+2.....
15:58:53.616710 IP localhost.hbci > localhost.54228: Flags [P.], seq 1137:1143, ack 832, win 6353, options [nop,nop,TS val 3585717195 ecr 3861590738], length 6
E..:..@.@...............,k.?.[8............
.....+2.
1
]
15:58:53.616714 IP localhost.hbci > localhost.54228: Flags [P.], seq 1143:1166, ack 832, win 6353, options [nop,nop,TS val 3585717195 ecr 3861590738], length 23
E..K..@.@...............,k.E.[8......?.....
.....+2.
11
 ["^ ","~:nation"
15:58:53.616718 IP localhost.hbci > localhost.54228: Flags [P.], seq 1166:1178, ack 832, win 6353, options [nop,nop,TS val 3585717195 ecr 3861590738], length 12
E..@..@.@...............,k.\.[8......4.....
.....+2.
7
,"PERU"
15:58:53.616723 IP localhost.54228 > localhost.hbci: Flags [.], ack 382, win 6062, options [nop,nop,TS val 3861590738 ecr 3585717195], length 0
E..4..@.@................[8.,k.L.....(.....
.+2.....
15:58:53.616723 IP localhost.hbci > localhost.54228: Flags [P.], seq 1178:1194, ack 832, win 6353, options [nop,nop,TS val 3585717195 ecr 3861590738], length 16
E..D..@.@...............,k.h.[8......8.....
.....+2.
B
,"~:o-year"
15:58:53.616729 IP localhost.hbci > localhost.54228: Flags [P.], seq 1194:1204, ack 832, win 6353, options [nop,nop,TS val 3585717195 ecr 3861590738], length 10
E..>..@.@...............,k.x.[8......2.....
.....+2.
5
,1992
15:58:53.616732 IP localhost.hbci > localhost.54228: Flags [P.], seq 1204:1224, ack 832, win 6353, options [nop,nop,TS val 3585717195 ecr 3861590738], length 20
E..H..@.@...............,k...[8......<.....
.....+2.
F
,"~:sum-profit"
15:58:53.616735 IP localhost.hbci > localhost.54228: Flags [P.], seq 1224:1249, ack 832, win 6353, options [nop,nop,TS val 3585717195 ecr 3861590738], length 25
E..M..@.@...............,k...[8......A.....
.....+2.
13
,1547989.7622000005
15:58:53.616740 IP localhost.hbci > localhost.54228: Flags [P.], seq 1249:1255, ack 832, win 6353, options [nop,nop,TS val 3585717195 ecr 3861590738], length 6
E..:..@.@...............,k...[8............
.....+2.
1
]
15:58:53.616742 IP localhost.54228 > localhost.hbci: Flags [.], ack 397, win 6061, options [nop,nop,TS val 3861590738 ecr 3585717195], length 0
E..4..@.@................[8.,k.[.....(.....
.+2.....
15:58:53.616745 IP localhost.hbci > localhost.54228: Flags [P.], seq 1255:1278, ack 832, win 6353, options [nop,nop,TS val 3585717195 ecr 3861590738], length 23
E..K..@.@...............,k...[8......?.....
.....+2.
11
 ["^ ","~:nation"
15:58:53.616748 IP localhost.hbci > localhost.54228: Flags [P.], seq 1278:1293, ack 832, win 6353, options [nop,nop,TS val 3585717195 ecr 3861590738], length 15
E..C..@.@...............,k...[8......7.....
.....+2.
A
,"ALGERIA"
15:58:53.616751 IP localhost.hbci > localhost.54228: Flags [P.], seq 1293:1309, ack 832, win 6353, options [nop,nop,TS val 3585717195 ecr 3861590738], length 16
E..D..@.@...............,k...[8......8.....
.....+2.
B
,"~:o-year"
15:58:53.616754 IP localhost.hbci > localhost.54228: Flags [P.], seq 1309:1319, ack 832, win 6353, options [nop,nop,TS val 3585717195 ecr 3861590738], length 10
E..>..@.@...............,k...[8......2.....
.....+2.
5
,1992
15:58:53.616756 IP localhost.hbci > localhost.54228: Flags [P.], seq 1319:1339, ack 832, win 6353, options [nop,nop,TS val 3585717195 ecr 3861590738], length 20
E..H..@.@...............,k...[8......<.....
.....+2.
F
,"~:sum-profit"
15:58:53.616759 IP localhost.hbci > localhost.54228: Flags [P.], seq 1339:1364, ack 832, win 6353, options [nop,nop,TS val 3585717195 ecr 3861590738], length 25
E..M..@.@...............,k.	.[8......A.....
.....+2.
13
,2392953.9277999997
15:58:53.616766 IP localhost.54228 > localhost.hbci: Flags [.], ack 443, win 6061, options [nop,nop,TS val 3861590738 ecr 3585717195], length 0
E..4..@.@................[8.,k.......(.....
.+2.....
15:58:53.616768 IP localhost.hbci > localhost.54228: Flags [P.], seq 1364:1370, ack 832, win 6353, options [nop,nop,TS val 3585717195 ecr 3861590738], length 6
E..:..@.@...............,k.".[8............
.....+2.
1
]
15:58:53.616774 IP localhost.hbci > localhost.54228: Flags [P.], seq 1370:1393, ack 832, win 6353, options [nop,nop,TS val 3585717195 ecr 3861590738], length 23
E..K..@.@...............,k.(.[8......?.....
.....+2.
11
 ["^ ","~:nation"
15:58:53.616777 IP localhost.hbci > localhost.54228: Flags [P.], seq 1393:1405, ack 832, win 6353, options [nop,nop,TS val 3585717195 ecr 3861590738], length 12
E..@..@.@...............,k.?.[8......4.....
.....+2.
7
,"IRAN"
15:58:53.616781 IP localhost.hbci > localhost.54228: Flags [P.], seq 1405:1421, ack 832, win 6353, options [nop,nop,TS val 3585717195 ecr 3861590738], length 16
E..D..@.@...............,k.K.[8......8.....
.....+2.
B
,"~:o-year"
15:58:53.616787 IP localhost.54228 > localhost.hbci: Flags [.], ack 474, win 6060, options [nop,nop,TS val 3861590738 ecr 3585717195], length 0
E..4..@.@................[8.,k.......(.....
.+2.....
15:58:53.616788 IP localhost.hbci > localhost.54228: Flags [P.], seq 1421:1431, ack 832, win 6353, options [nop,nop,TS val 3585717195 ecr 3861590738], length 10
E..>..@.@...............,k.[.[8......2.....
.....+2.
5
,1992
15:58:53.616794 IP localhost.hbci > localhost.54228: Flags [P.], seq 1431:1451, ack 832, win 6353, options [nop,nop,TS val 3585717195 ecr 3861590738], length 20
E..H..@.@...............,k.e.[8......<.....
.....+2.
F
,"~:sum-profit"
15:58:53.616797 IP localhost.hbci > localhost.54228: Flags [P.], seq 1451:1476, ack 832, win 6353, options [nop,nop,TS val 3585717195 ecr 3861590738], length 25
E..M..@.@...............,k.y.[8......A.....
.....+2.
13
,2706298.0419999994
15:58:53.616800 IP localhost.hbci > localhost.54228: Flags [P.], seq 1476:1482, ack 832, win 6353, options [nop,nop,TS val 3585717195 ecr 3861590738], length 6
E..:..@.@...............,k...[8............
.....+2.
1
]
15:58:53.616804 IP localhost.hbci > localhost.54228: Flags [P.], seq 1482:1505, ack 832, win 6353, options [nop,nop,TS val 3585717195 ecr 3861590738], length 23
E..K..@.@...............,k...[8......?.....
.....+2.
11
 ["^ ","~:nation"
15:58:53.616807 IP localhost.hbci > localhost.54228: Flags [P.], seq 1505:1519, ack 832, win 6353, options [nop,nop,TS val 3585717195 ecr 3861590738], length 14
E..B..@.@...............,k...[8......6.....
.....+2.
9
,"FRANCE"
15:58:53.616810 IP localhost.hbci > localhost.54228: Flags [P.], seq 1519:1535, ack 832, win 6353, options [nop,nop,TS val 3585717195 ecr 3861590738], length 16
E..D..@.@...............,k...[8......8.....
.....+2.
B
,"~:o-year"
15:58:53.616813 IP localhost.hbci > localhost.54228: Flags [P.], seq 1535:1545, ack 832, win 6353, options [nop,nop,TS val 3585717195 ecr 3861590738], length 10
E..>..@.@...............,k...[8......2.....
.....+2.
5
,1992
15:58:53.616815 IP localhost.hbci > localhost.54228: Flags [P.], seq 1545:1565, ack 832, win 6353, options [nop,nop,TS val 3585717195 ecr 3861590738], length 20
E..H..@.@...............,k...[8......<.....
.....+2.
F
,"~:sum-profit"
15:58:53.616818 IP localhost.hbci > localhost.54228: Flags [P.], seq 1565:1583, ack 832, win 6353, options [nop,nop,TS val 3585717195 ecr 3861590738], length 18
E..F..@.@...............,k...[8......:.....
.....+2.
D
,1694200.8198
15:58:53.616821 IP localhost.hbci > localhost.54228: Flags [P.], seq 1583:1589, ack 832, win 6353, options [nop,nop,TS val 3585717195 ecr 3861590738], length 6
E..:..@.@...............,k...[8............
.....+2.
1
]
15:58:53.616825 IP localhost.hbci > localhost.54228: Flags [P.], seq 1589:1612, ack 832, win 6353, options [nop,nop,TS val 3585717195 ecr 3861590738], length 23
E..K..@.@...............,k...[8......?.....
.....+2.
11
 ["^ ","~:nation"
15:58:53.616828 IP localhost.hbci > localhost.54228: Flags [P.], seq 1612:1630, ack 832, win 6353, options [nop,nop,TS val 3585717195 ecr 3861590738], length 18
E..F..@.@...............,k...[8......:.....
.....+2.
D
,"MOZAMBIQUE"
15:58:53.616831 IP localhost.hbci > localhost.54228: Flags [P.], seq 1630:1646, ack 832, win 6353, options [nop,nop,TS val 3585717195 ecr 3861590738], length 16
E..D..@.@...............,k.,.[8......8.....
.....+2.
B
,"~:o-year"
15:58:53.616839 IP localhost.54228 > localhost.hbci: Flags [.], ack 594, win 6058, options [nop,nop,TS val 3861590738 ecr 3585717195], length 0
E..4..@.@................[8.,k. .....(.....
.+2.....
15:58:53.616840 IP localhost.hbci > localhost.54228: Flags [P.], seq 1646:1656, ack 832, win 6353, options [nop,nop,TS val 3585717195 ecr 3861590738], length 10
E..>..@.@...............,k.<.[8......2.....
.....+2.
5
,1996
15:58:53.616849 IP localhost.hbci > localhost.54228: Flags [P.], seq 1656:1676, ack 832, win 6353, options [nop,nop,TS val 3585717195 ecr 3861590738], length 20
E..H..@.@...............,k.F.[8......<.....
.....+2.
F
,"~:sum-profit"
15:58:53.616852 IP localhost.hbci > localhost.54228: Flags [P.], seq 1676:1694, ack 832, win 6353, options [nop,nop,TS val 3585717195 ecr 3861590738], length 18
E..F..@.@...............,k.Z.[8......:.....
.....+2.
D
,1958458.3082
15:58:53.616856 IP localhost.hbci > localhost.54228: Flags [P.], seq 1694:1700, ack 832, win 6353, options [nop,nop,TS val 3585717195 ecr 3861590738], length 6
E..:..@.@...............,k.l.[8............
.....+2.
1
]
15:58:53.616866 IP localhost.hbci > localhost.54228: Flags [P.], seq 1700:1723, ack 832, win 6353, options [nop,nop,TS val 3585717195 ecr 3861590738], length 23
E..K..@.@...............,k.r.[8......?.....
.....+2.
11
 ["^ ","~:nation"
15:58:53.616869 IP localhost.54228 > localhost.hbci: Flags [.], ack 701, win 6057, options [nop,nop,TS val 3861590738 ecr 3585717195], length 0
E..4..@.@................[8.,k.......(.....
.+2.....
15:58:53.616875 IP localhost.hbci > localhost.54228: Flags [P.], seq 1723:1737, ack 832, win 6353, options [nop,nop,TS val 3585717195 ecr 3861590738], length 14
E..B..@.@...............,k...[8......6.....
.....+2.
9
,"RUSSIA"
15:58:53.616878 IP localhost.hbci > localhost.54228: Flags [P.], seq 1737:1753, ack 832, win 6353, options [nop,nop,TS val 3585717195 ecr 3861590738], length 16
E..D..@.@...............,k...[8......8.....
.....+2.
B
,"~:o-year"
15:58:53.616881 IP localhost.hbci > localhost.54228: Flags [P.], seq 1753:1763, ack 832, win 6353, options [nop,nop,TS val 3585717195 ecr 3861590738], length 10
E..>..@.@...............,k...[8......2.....
.....+2.
5
,1992
15:58:53.616884 IP localhost.hbci > localhost.54228: Flags [P.], seq 1763:1783, ack 832, win 6353, options [nop,nop,TS val 3585717195 ecr 3861590738], length 20
E..H..@.@...............,k...[8......<.....
.....+2.
F
,"~:sum-profit"
15:58:53.616891 IP localhost.54228 > localhost.hbci: Flags [.], ack 789, win 6055, options [nop,nop,TS val 3861590738 ecr 3585717195], length 0
E..4..@.@................[8.,k.......(.....
.+2.....
15:58:53.616892 IP localhost.hbci > localhost.54228: Flags [P.], seq 1783:1808, ack 832, win 6353, options [nop,nop,TS val 3585717195 ecr 3861590738], length 25
E..M..@.@...............,k...[8......A.....
.....+2.
13
,2657932.9605000014
15:58:53.616899 IP localhost.hbci > localhost.54228: Flags [P.], seq 1808:1814, ack 832, win 6353, options [nop,nop,TS val 3585717195 ecr 3861590738], length 6
E..:..@.@...............,k...[8............
.....+2.
1
]
15:58:53.616904 IP localhost.hbci > localhost.54228: Flags [P.], seq 1814:1837, ack 832, win 6353, options [nop,nop,TS val 3585717195 ecr 3861590738], length 23
E..K..@.@...............,k...[8......?.....
.....+2.
11
 ["^ ","~:nation"
15:58:53.616907 IP localhost.hbci > localhost.54228: Flags [P.], seq 1837:1851, ack 832, win 6353, options [nop,nop,TS val 3585717195 ecr 3861590738], length 14
E..B..@.@...............,k...[8......6.....
.....+2.
9
,"BRAZIL"
15:58:53.616912 IP localhost.54228 > localhost.hbci: Flags [.], ack 850, win 6054, options [nop,nop,TS val 3861590738 ecr 3585717195], length 0
E..4..@.@................[8.,k. .....(.....
.+2.....
15:58:53.616916 IP localhost.hbci > localhost.54228: Flags [P.], seq 1851:1867, ack 832, win 6353, options [nop,nop,TS val 3585717195 ecr 3861590738], length 16
E..D..@.@...............,k.	.[8......8.....
.....+2.
B
,"~:o-year"
15:58:53.616920 IP localhost.hbci > localhost.54228: Flags [P.], seq 1867:1877, ack 832, win 6353, options [nop,nop,TS val 3585717195 ecr 3861590738], length 10
E..>..@.@...............,k...[8......2.....
.....+2.
5
,1993
15:58:53.616923 IP localhost.hbci > localhost.54228: Flags [P.], seq 1877:1897, ack 832, win 6353, options [nop,nop,TS val 3585717195 ecr 3861590738], length 20
E..H..@.@...............,k.#.[8......<.....
.....+2.
F
,"~:sum-profit"
15:58:53.616927 IP localhost.hbci > localhost.54228: Flags [P.], seq 1897:1922, ack 832, win 6353, options [nop,nop,TS val 3585717195 ecr 3861590738], length 25
E..M..@.@...............,k.7.[8......A.....
.....+2.
13
,2337236.7041000007
15:58:53.616932 IP localhost.54228 > localhost.hbci: Flags [.], ack 920, win 6053, options [nop,nop,TS val 3861590738 ecr 3585717195], length 0
E..4..@.@................[8.,k.f.....(.....
.+2.....
15:58:53.616936 IP localhost.hbci > localhost.54228: Flags [P.], seq 1922:1928, ack 832, win 6353, options [nop,nop,TS val 3585717195 ecr 3861590738], length 6
E..:..@.@...............,k.P.[8............
.....+2.
1
]
15:58:53.616941 IP localhost.hbci > localhost.54228: Flags [P.], seq 1928:1951, ack 832, win 6353, options [nop,nop,TS val 3585717195 ecr 3861590738], length 23
E..K..@.@...............,k.V.[8......?.....
.....+2.
11
 ["^ ","~:nation"
15:58:53.616947 IP localhost.hbci > localhost.54228: Flags [P.], seq 1951:1974, ack 832, win 6353, options [nop,nop,TS val 3585717195 ecr 3861590738], length 23
E..K..@.@...............,k.m.[8......?.....
.....+2.
11
,"UNITED KINGDOM"
15:58:53.616950 IP localhost.hbci > localhost.54228: Flags [P.], seq 1974:1990, ack 832, win 6353, options [nop,nop,TS val 3585717195 ecr 3861590738], length 16
E..D..@.@...............,k...[8......8.....
.....+2.
B
,"~:o-year"
15:58:53.616956 IP localhost.54228 > localhost.hbci: Flags [.], ack 1003, win 6052, options [nop,nop,TS val 3861590738 ecr 3585717195], length 0
E..4..@.@................[8.,k.......(.....
.+2.....
15:58:53.616957 IP localhost.hbci > localhost.54228: Flags [P.], seq 1990:2000, ack 832, win 6353, options [nop,nop,TS val 3585717195 ecr 3861590738], length 10
E..>..@.@...............,k...[8......2.....
.....+2.
5
,1995
15:58:53.616965 IP localhost.hbci > localhost.54228: Flags [P.], seq 2000:2020, ack 832, win 6353, options [nop,nop,TS val 3585717195 ecr 3861590738], length 20
E..H..@.@...............,k...[8......<.....
.....+2.
F
,"~:sum-profit"
15:58:53.616969 IP localhost.hbci > localhost.54228: Flags [P.], seq 2020:2045, ack 832, win 6353, options [nop,nop,TS val 3585717195 ecr 3861590738], length 25
E..M..@.@...............,k...[8......A.....
.....+2.
13
,2814357.4740999998
15:58:53.616976 IP localhost.54228 > localhost.hbci: Flags [.], ack 1074, win 6051, options [nop,nop,TS val 3861590738 ecr 3585717195], length 0
E..4..@.@................[8.,k.......(.....
.+2.....
15:58:53.616977 IP localhost.hbci > localhost.54228: Flags [P.], seq 2045:2051, ack 832, win 6353, options [nop,nop,TS val 3585717195 ecr 3861590738], length 6
E..:..@.@...............,k...[8............
.....+2.
1
]
15:58:53.616985 IP localhost.hbci > localhost.54228: Flags [P.], seq 2051:2074, ack 832, win 6353, options [nop,nop,TS val 3585717195 ecr 3861590738], length 23
E..K..@.@...............,k...[8......?.....
.....+2.
11
 ["^ ","~:nation"
15:58:53.616989 IP localhost.hbci > localhost.54228: Flags [P.], seq 2074:2088, ack 832, win 6353, options [nop,nop,TS val 3585717195 ecr 3861590738], length 14
E..B..@.@...............,k...[8......6.....
.....+2.
9
,"BRAZIL"
15:58:53.616996 IP localhost.hbci > localhost.54228: Flags [P.], seq 2088:2104, ack 832, win 6353, options [nop,nop,TS val 3585717195 ecr 3861590738], length 16
E..D..@.@...............,k...[8......8.....
.....+2.
B
,"~:o-year"
15:58:53.616997 IP localhost.54228 > localhost.hbci: Flags [.], ack 1137, win 6050, options [nop,nop,TS val 3861590738 ecr 3585717195], length 0
E..4..@.@................[8.,k.?.....(.....
.+2.....
15:58:53.617000 IP localhost.hbci > localhost.54228: Flags [P.], seq 2104:2114, ack 832, win 6353, options [nop,nop,TS val 3585717195 ecr 3861590738], length 10
E..>..@.@...............,k...[8......2.....
.....+2.
5
,1998
15:58:53.617006 IP localhost.hbci > localhost.54228: Flags [P.], seq 2114:2134, ack 832, win 6353, options [nop,nop,TS val 3585717195 ecr 3861590738], length 20
E..H..@.@...............,k...[8......<.....
.....+2.
F
,"~:sum-profit"
15:58:53.617011 IP localhost.hbci > localhost.54228: Flags [P.], seq 2134:2152, ack 832, win 6353, options [nop,nop,TS val 3585717195 ecr 3861590738], length 18
E..F..@.@...............,k.$.[8......:.....
.....+2.
D
,1153370.2911
15:58:53.617016 IP localhost.hbci > localhost.54228: Flags [P.], seq 2152:2158, ack 832, win 6353, options [nop,nop,TS val 3585717195 ecr 3861590738], length 6
E..:..@.@...............,k.6.[8............
.....+2.
1
]
15:58:53.617019 IP localhost.54228 > localhost.hbci: Flags [.], ack 1194, win 6049, options [nop,nop,TS val 3861590738 ecr 3585717195], length 0
E..4..@.@................[8.,k.x.....(.....
.+2.....
15:58:53.617027 IP localhost.hbci > localhost.54228: Flags [P.], seq 2158:2181, ack 832, win 6353, options [nop,nop,TS val 3585717195 ecr 3861590738], length 23
E..K..@.@...............,k.<.[8......?.....
.....+2.
11
 ["^ ","~:nation"
15:58:53.617030 IP localhost.hbci > localhost.54228: Flags [P.], seq 2181:2195, ack 832, win 6353, options [nop,nop,TS val 3585717195 ecr 3861590738], length 14
E..B..@.@...............,k.S.[8......6.....
.....+2.
9
,"JORDAN"
15:58:53.617033 IP localhost.hbci > localhost.54228: Flags [P.], seq 2195:2211, ack 832, win 6353, options [nop,nop,TS val 3585717195 ecr 3861590738], length 16
E..D..@.@...............,k.a.[8......8.....
.....+2.
B
,"~:o-year"
15:58:53.617036 IP localhost.hbci > localhost.54228: Flags [P.], seq 2211:2221, ack 832, win 6353, options [nop,nop,TS val 3585717195 ecr 3861590738], length 10
E..>..@.@...............,k.q.[8......2.....
.....+2.
5
,1995
15:58:53.617038 IP localhost.hbci > localhost.54228: Flags [P.], seq 2221:2241, ack 832, win 6353, options [nop,nop,TS val 3585717195 ecr 3861590738], length 20
E..H..@.@...............,k.{.[8......<.....
.....+2.
F
,"~:sum-profit"
15:58:53.617042 IP localhost.hbci > localhost.54228: Flags [P.], seq 2241:2266, ack 832, win 6353, options [nop,nop,TS val 3585717195 ecr 3861590738], length 25
E..M..@.@...............,k...[8......A.....
.....+2.
13
,1917591.3229000007
15:58:53.617046 IP localhost.hbci > localhost.54228: Flags [P.], seq 2266:2272, ack 832, win 6353, options [nop,nop,TS val 3585717195 ecr 3861590738], length 6
E..:..@.@...............,k...[8............
.....+2.
1
]
15:58:53.617051 IP localhost.hbci > localhost.54228: Flags [P.], seq 2272:2295, ack 832, win 6353, options [nop,nop,TS val 3585717195 ecr 3861590738], length 23
E..K..@.@...............,k...[8......?.....
.....+2.
11
 ["^ ","~:nation"
15:58:53.617054 IP localhost.hbci > localhost.54228: Flags [P.], seq 2295:2313, ack 832, win 6353, options [nop,nop,TS val 3585717195 ecr 3861590738], length 18
E..F..@.@...............,k...[8......:.....
.....+2.
D
,"MOZAMBIQUE"
15:58:53.617057 IP localhost.hbci > localhost.54228: Flags [P.], seq 2313:2329, ack 832, win 6353, options [nop,nop,TS val 3585717195 ecr 3861590738], length 16
E..D..@.@...............,k...[8......8.....
.....+2.
B
,"~:o-year"
15:58:53.617060 IP localhost.hbci > localhost.54228: Flags [P.], seq 2329:2339, ack 832, win 6353, options [nop,nop,TS val 3585717195 ecr 3861590738], length 10
E..>..@.@...............,k...[8......2.....
.....+2.
5
,1993
15:58:53.617063 IP localhost.hbci > localhost.54228: Flags [P.], seq 2339:2359, ack 832, win 6353, options [nop,nop,TS val 3585717195 ecr 3861590738], length 20
E..H..@.@...............,k...[8......<.....
.....+2.
F
,"~:sum-profit"
15:58:53.617066 IP localhost.hbci > localhost.54228: Flags [P.], seq 2359:2377, ack 832, win 6353, options [nop,nop,TS val 3585717195 ecr 3861590738], length 18
E..F..@.@...............,k...[8......:.....
.....+2.
D
,2563042.9969
15:58:53.617069 IP localhost.hbci > localhost.54228: Flags [P.], seq 2377:2383, ack 832, win 6353, options [nop,nop,TS val 3585717195 ecr 3861590738], length 6
E..:..@.@...............,k...[8............
.....+2.
1
]
15:58:53.617073 IP localhost.hbci > localhost.54228: Flags [P.], seq 2383:2406, ack 832, win 6353, options [nop,nop,TS val 3585717195 ecr 3861590738], length 23
E..K..@.@...............,k...[8......?.....
.....+2.
11
 ["^ ","~:nation"
15:58:53.617076 IP localhost.hbci > localhost.54228: Flags [P.], seq 2406:2421, ack 832, win 6353, options [nop,nop,TS val 3585717195 ecr 3861590738], length 15
E..C..@.@...............,k.4.[8......7.....
.....+2.
A
,"GERMANY"
15:58:53.617079 IP localhost.hbci > localhost.54228: Flags [P.], seq 2421:2437, ack 832, win 6353, options [nop,nop,TS val 3585717195 ecr 3861590738], length 16
E..D..@.@...............,k.C.[8......8.....
.....+2.
B
,"~:o-year"
15:58:53.617082 IP localhost.hbci > localhost.54228: Flags [P.], seq 2437:2447, ack 832, win 6353, options [nop,nop,TS val 3585717195 ecr 3861590738], length 10
E..>..@.@...............,k.S.[8......2.....
.....+2.
5
,1994
